{
  "service": "michi-stream-hifi",
  "name": "Michi Stream Cocina",
  "server_id": "7c9e6679-7425-40de-944b-e07fc1f90ae7",
  "version": "0.3.0",
  "api_version": "v1-lite",
  "roles": [
    "audio_receiver"
  ],
  "identity_scheme": "ed25519-blake3-v1",
  "michi_id": "f2UwxQaeA6vA8LO7Cr1nGRr5MStned_Gbmc_ua48qUc",
  "public_key": "RpHnJr9oP1DXBkPuIMuk0hJ2hAJ5SiWO2hAQVCMGREE",
  "michi_home_id": "FU1FL-wFLfsfew3qpbR7XjDkmStWZY4g84MyW-zXPOs",
  "auth": {
    "required": true,
    "strategy": "HOME_MEMBERSHIP",
    "token_refresh": false
  },
  "features": {
    "session": true,
    "heartbeat": true,
    "volume": true,
    "now_playing": false,
    "diagnostics": false,
    "ota": false
  },
  "audio": {
    "transports": [
      "rtp_udp"
    ],
    "codecs": [
      "pcm_s16le"
    ],
    "sample_rates": [
      48000
    ],
    "bit_depths": [
      16
    ],
    "channels": [
      2
    ],
    "packet_ms": [
      10
    ],
    "payload_types": [
      97
    ],
    "buffer_ms_min": 50,
    "buffer_ms_max": 500
  }
}
